category,question,keywords,answer
TPO Policy,Can a BTech student apply for a company whose CTC falls within the Betterment Gap?,"BTech, apply, CTC, Betterment Gap","No, a BTech student cannot apply for a company with a CTC within the Betterment Gap."
TPO Policy,What are the consequences if a BTech student is waitlisted by a company?,"BTech, waitlisted, job, betterment switch","If a student is waitlisted and later gets a job in another company, they will have a choice to decide between the two offers, but it will be counted as a betterment switch."
TPO Policy,What if a BTech student is waitlisted by a company and later gets another job offer?,"BTech, waitlisted, job, betterment switch","If a student is waitlisted and later gets a job in another company, they will have a choice to decide between the two offers, but it will be counted as a betterment switch."
TPO Policy,What happens to a BTech student who is waitlisted by a company and later gets another job offer?,"BTech, waitlisted, job, betterment switch","If a student is waitlisted and later gets a job in another company, they will have a choice to decide between the two offers, but it will be counted as a betterment switch."
TPO Policy,What is the policy for a BTech student who is waitlisted by a company and later gets another job offer?,"BTech, waitlisted, job, betterment switch","If a student is waitlisted and later gets a job in another company, they will have a choice to decide between the two offers, but it will be counted as a betterment switch."
TPO Policy,Are BTech students allowed to apply for the same company during placements if they have interned there?,"BTech, intern, apply, same company, placement process","No, students interning at a particular company are not permitted to apply for the same company through the placement process."
TPO Policy,Can BTech students apply for placements at a company where they have interned?,"BTech, intern, apply, same company, placement process","No, students interning at a particular company are not permitted to apply for the same company through the placement process."
TPO Policy,Is it permissible for BTech students to apply for the same company during placements after interning there?,"BTech, intern, apply, same company, placement process","No, students interning at a particular company are not permitted to apply for the same company through the placement process."
TPO Policy,Can BTech students apply for the same company during placements if they have completed an internship there?,"BTech, intern, apply, same company, placement process","No, students interning at a particular company are not permitted to apply for the same company through the placement process."
TPO Policy,Which branches are considered circuit branches in the placement policy?,"circuit branches, placement policy, Electronics, Telecommunication Engineering, Electrical Engineering","Circuit branches include Electronics and Telecommunication Engineering, Electronics Engineering, and Electrical Engineering."
TPO Policy,What branches are included under the circuit category in the placement policy?,"circuit branches, placement policy, Electronics, Telecommunication Engineering, Electrical Engineering","Circuit branches include Electronics and Telecommunication Engineering, Electronics Engineering, and Electrical Engineering."
TPO Policy,Which engineering branches are classified as circuit branches in the placement policy?,"circuit branches, placement policy, Electronics, Telecommunication Engineering, Electrical Engineering","Circuit branches include Electronics and Telecommunication Engineering, Electronics Engineering, and Electrical Engineering."
TPO Policy,What are the engineering branches that fall under the circuit category in the placement policy?,"circuit branches, placement policy, Electronics, Telecommunication Engineering, Electrical Engineering","Circuit branches include Electronics and Telecommunication Engineering, Electronics Engineering, and Electrical Engineering."
TPO Policy,What is the status of a BTech student who receives a PPO?,"BTech, PPO, placed","Once a student gets a PPO, they are considered placed in that company."
TPO Policy,What happens to a BTech student after receiving a PPO?,"BTech, PPO, placed","Once a student gets a PPO, they are considered placed in that company."
TPO Policy,What is the outcome for a BTech student who gets a PPO?,"BTech, PPO, placed","Once a student gets a PPO, they are considered placed in that company."
TPO Policy,What happens when a BTech student receives a PPO?,"BTech, PPO, placed","Once a student gets a PPO, they are considered placed in that company."
TPO Policy,Under what conditions can a BTech student reject a PPO?,"BTech, reject, PPO, CTC, 11 LPA",A PPO can be rejected if it has a CTC of less than 11 LPA.
TPO Policy,When can a BTech student reject a PPO?,"BTech, reject, PPO, CTC, 11 LPA",A PPO can be rejected if it has a CTC of less than 11 LPA.
TPO Policy,Are there any conditions under which a BTech student can reject a PPO?,"BTech, reject, PPO, CTC, 11 LPA",A PPO can be rejected if it has a CTC of less than 11 LPA.
TPO Policy,Can a BTech student reject a PPO if the CTC is less than 11 LPA?,"BTech, reject, PPO, CTC, 11 LPA",A PPO can be rejected if it has a CTC of less than 11 LPA.
TPO Policy,Are BTech students allowed to pursue postgraduate studies after accepting a PPO?,"BTech, postgraduate studies, PPO","Yes, students can pursue postgraduate studies after accepting a PPO if they wish."
TPO Policy,Can BTech students go for higher studies after accepting a PPO?,"BTech, higher studies, PPO","Yes, students can pursue postgraduate studies after accepting a PPO if they wish."
TPO Policy,Is it permissible for BTech students to pursue postgraduate studies after accepting a PPO?,"BTech, postgraduate studies, PPO","Yes, students can pursue postgraduate studies after accepting a PPO if they wish."
TPO Policy,Can BTech students apply for postgraduate studies after accepting a PPO?,"BTech, postgraduate studies, PPO","Yes, students can pursue postgraduate studies after accepting a PPO if they wish."
TPO Policy,How many offers can a BTech student receive through the placement process?,"BTech, offers, placement process",A BTech student can receive a maximum of two offers through the placement process.
TPO Policy,What is the limit on the number of offers for a BTech student through the placement process?,"BTech, limit, offers, placement process",A BTech student can receive a maximum of two offers through the placement process.
TPO Policy,How many placement offers can a BTech student get?,"BTech, placement offers",A BTech student can receive a maximum of two offers through the placement process.
TPO Policy,What is the maximum number of placement offers for a BTech student?,"BTech, maximum, placement offers",A BTech student can receive a maximum of two offers through the placement process.
TPO Policy,Does the TPO have any role in academic matters?,"TPO, academic matters, examination-related","No, the TPO has no say in academic and examination-related matters."
TPO Policy,Is the TPO involved in academic matters?,"TPO, academic matters, examination-related","No, the TPO has no say in academic and examination-related matters."
TPO Policy,Does the TPO handle academic matters?,"TPO, academic matters, examination-related","No, the TPO has no say in academic and examination-related matters."
TPO Policy,Is the TPO responsible for academic matters?,"TPO, academic matters, examination-related","No, the TPO has no say in academic and examination-related matters."
TPO Policy,Does the TPO have any involvement in academic matters?,"TPO, academic matters, examination-related","No, the TPO has no say in academic and examination-related matters."
TPO Policy,Can students do internships that overlap with academic activities?,"students, internships, overlap, academic activities","No, students cannot do internships that overlap with academic activities."
TPO Policy,Are students allowed to do internships that overlap with academic activities?,"students, internships, overlap, academic activities","No, students cannot do internships that overlap with academic activities."
TPO Policy,Can students undertake internships that overlap with academic activities?,"students, internships, overlap, academic activities","No, students cannot do internships that overlap with academic activities."
TPO Policy,Is it permissible for students to do internships that overlap with academic activities?,"students, internships, overlap, academic activities","No, students cannot do internships that overlap with academic activities."
TPO Policy,Can students participate in internships that overlap with academic activities?,"students, internships, overlap, academic activities","No, students cannot do internships that overlap with academic activities."
TPO Policy,What happens if a company offers internships during academic activities?,"company, internships, academic activities, TPO",The TPO will not allow companies to offer internships that overlap with academic activities.
TPO Policy,What is the policy if a company offers internships during academic activities?,"company, internships, academic activities, TPO",The TPO will not allow companies to offer internships that overlap with academic activities.
TPO Policy,What happens when a company offers internships that overlap with academic activities?,"company, internships, academic activities, TPO",The TPO will not allow companies to offer internships that overlap with academic activities.
TPO Policy,What is the consequence if a company offers internships during academic activities?,"company, internships, academic activities, TPO",The TPO will not allow companies to offer internships that overlap with academic activities.
TPO Policy,What action will the TPO take if a company offers internships during academic activities?,"company, internships, academic activities, TPO",The TPO will not allow companies to offer internships that overlap with academic activities.
TPO Policy,Does the TPO allow companies to offer internships during exam periods?,"TPO, internships, exam periods","No, the TPO does not allow companies to offer internships during exam periods."
TPO Policy,Are companies allowed to offer internships during exam periods by the TPO?,"TPO, internships, exam periods","No, the TPO does not allow companies to offer internships during exam periods."
TPO Policy,Can companies offer internships during exam periods according to the TPO?,"TPO, internships, exam periods","No, the TPO does not allow companies to offer internships during exam periods."
TPO Policy,Is it permissible for companies to offer internships during exam periods by the TPO?,"TPO, internships, exam periods","No, the TPO does not allow companies to offer internships during exam periods."
TPO Policy,Does the TPO permit companies to offer internships during exam periods?,"TPO, internships, exam periods","No, the TPO does not allow companies to offer internships during exam periods."
TPO Policy,What is the role of the institute’s academic section in the placement process?,"academic section, placement process, internships, academic activities",The academic section ensures that internships and placements do not overlap with academic activities.
TPO Policy,What does the academic section do in the placement process?,"academic section, placement process, internships, academic activities",The academic section ensures that internships and placements do not overlap with academic activities.
TPO Policy,How does the academic section contribute to the placement process?,"academic section, placement process, internships, academic activities",The academic section ensures that internships and placements do not overlap with academic activities.
TPO Policy,What is the function of the academic section in the placement process?,"academic section, placement process, internships, academic activities",The academic section ensures that internships and placements do not overlap with academic activities.
TPO Policy,What role does the academic section play in the placement process?,"academic section, placement process, internships, academic activities",The academic section ensures that internships and placements do not overlap with academic activities.
TPO Policy,Can students request academic leave for internships?,"students, academic leave, internships, academic activities","No, students cannot request academic leave for internships that overlap with academic activities."
TPO Policy,Are students allowed to request academic leave for internships?,"students, academic leave, internships, academic activities","No, students cannot request academic leave for internships that overlap with academic activities."
TPO Policy,Can students apply for academic leave for internships?,"students, academic leave, internships, academic activities","No, students cannot request academic leave for internships that overlap with academic activities."
TPO Policy,Is it permissible for students to request academic leave for internships?,"students, academic leave, internships, academic activities","No, students cannot request academic leave for internships that overlap with academic activities."
TPO Policy,Can students take academic leave for internships?,"students, academic leave, internships, academic activities","No, students cannot request academic leave for internships that overlap with academic activities."
TPO Policy,What happens if a student misses academic activities due to internships?,"student, misses, academic activities, internships, penalties",The student may face academic penalties for missing activities.
TPO Policy,What are the consequences if a student misses academic activities due to internships?,"student, misses, academic activities, internships, penalties",The student may face academic penalties for missing activities.
TPO Policy,What if a student misses academic activities because of internships?,"student, misses, academic activities, internships, penalties",The student may face academic penalties for missing activities.
TPO Policy,What happens to a student who misses academic activities due to internships?,"student, misses, academic activities, internships, penalties",The student may face academic penalties for missing activities.
TPO Policy,What penalties might a student face for missing academic activities due to internships?,"student, misses, academic activities, internships, penalties",The student may face academic penalties for missing activities.
TPO Policy,Can students apply for internships during their final year?,"students, internships, final year, academic activities","No, students cannot apply for internships during their final year if it overlaps with academic activities."
TPO Policy,Are students allowed to apply for internships during their final year?,"students, internships, final year, academic activities","No, students cannot apply for internships during their final year if it overlaps with academic activities."
TPO Policy,Can students pursue internships during their final year?,"students, internships, final year, academic activities","No, students cannot apply for internships during their final year if it overlaps with academic activities."
TPO Policy,Is it permissible for students to apply for internships during their final year?,"students, internships, final year, academic activities","No, students cannot apply for internships during their final year if it overlaps with academic activities."
TPO Policy,Can students apply for internships in their final year?,"students, internships, final year, academic activities","No, students cannot apply for internships during their final year if it overlaps with academic activities."
TPO Policy,Does the TPO coordinate with the academic section for internship dates?,"TPO, academic section, internship dates, academic activities","Yes, the TPO coordinates with the academic section to ensure internship dates do not overlap with academic activities."
TPO Policy,Is the TPO in coordination with the academic section for internship dates?,"TPO, academic section, internship dates, academic activities","Yes, the TPO coordinates with the academic section to ensure internship dates do not overlap with academic activities."
TPO Policy,Does the TPO work with the academic section to set internship dates?,"TPO, academic section, internship dates, academic activities","Yes, the TPO coordinates with the academic section to ensure internship dates do not overlap with academic activities."
TPO Policy,Does the TPO collaborate with the academic section for internship dates?,"TPO, academic section, internship dates, academic activities","Yes, the TPO coordinates with the academic section to ensure internship dates do not overlap with academic activities."
TPO Policy,Does the TPO coordinate internship dates with the academic section?,"TPO, academic section, internship dates, academic activities","Yes, the TPO coordinates with the academic section to ensure internship dates do not overlap with academic activities."
TPO Policy,What is the official academic calendar’s role in the placement process?,"official academic calendar, placement process, schedule, conflicts",The official academic calendar is used to schedule placements and internships to avoid conflicts with academic activities.
TPO Policy,How does the official academic calendar impact the placement process?,"official academic calendar, placement process, schedule, conflicts",The official academic calendar is used to schedule placements and internships to avoid conflicts with academic activities.
TPO Policy,What role does the official academic calendar play in the placement process?,"official academic calendar, placement process, schedule, conflicts",The official academic calendar is used to schedule placements and internships to avoid conflicts with academic activities.
TPO Policy,How is the official academic calendar used in the placement process?,"official academic calendar, placement process, schedule, conflicts",The official academic calendar is used to schedule placements and internships to avoid conflicts with academic activities.
TPO Policy,What is the purpose of the official academic calendar in the placement process?,"official academic calendar, placement process, schedule, conflicts",The official academic calendar is used to schedule placements and internships to avoid conflicts with academic activities.
TPO Policy,How does the TPO allot dates to companies for placements?,"TPO, allot dates, companies, placements, parameters","The TPO allots dates based on parameters such as job profile and growth prospects, the package (CTC) being offered, past recruitment records, and feedback from students."
TPO Policy,How does the TPO assign dates to companies for placements?,"TPO, assign dates, companies, placements, parameters","The TPO allots dates based on parameters such as job profile and growth prospects, the package (CTC) being offered, past recruitment records, and feedback from students."
TPO Policy,How does the TPO schedule dates for companies for placements?,"TPO, schedule dates, companies, placements, parameters","The TPO allots dates based on parameters such as job profile and growth prospects, the package (CTC) being offered, past recruitment records, and feedback from students."
TPO Policy,How does the TPO allocate dates to companies for placements?,"TPO, allocate dates, companies, placements, parameters","The TPO allots dates based on parameters such as job profile and growth prospects, the package (CTC) being offered, past recruitment records, and feedback from students."
TPO Policy,How does the TPO determine dates for companies for placements?,"TPO, determine dates, companies, placements, parameters","The TPO allots dates based on parameters such as job profile and growth prospects, the package (CTC) being offered, past recruitment records, and feedback from students."
TPO Policy,What parameters are used to rank companies for placement dates?,"parameters, rank, companies, placement dates, job profile, growth prospects, CTC, recruitment records, feedback","Parameters include job profile and growth prospects, the package (CTC) being offered, past recruitment records, and feedback from students."
TPO Policy,What criteria are used to rank companies for placement dates?,"criteria, rank, companies, placement dates, job profile, growth prospects, CTC, recruitment records, feedback","Parameters include job profile and growth prospects, the package (CTC) being offered, past recruitment records, and feedback from students."
TPO Policy,What factors are considered to rank companies for placement dates?,"factors, rank, companies, placement dates, job profile, growth prospects, CTC, recruitment records, feedback","Parameters include job profile and growth prospects, the package (CTC) being offered, past recruitment records, and feedback from students."
TPO Policy,What parameters determine the ranking of companies for placement dates?,"parameters, determine, ranking, companies, placement dates, job profile, growth prospects, CTC, recruitment records, feedback","Parameters include job profile and growth prospects, the package (CTC) being offered, past recruitment records, and feedback from students."
TPO Policy,What parameters are considered for ranking companies for placement dates?,"parameters, consider, ranking, companies, placement dates, job profile, growth prospects, CTC, recruitment records, feedback","Parameters include job profile and growth prospects, the package (CTC) being offered, past recruitment records, and feedback from students."
TPO Policy,When should companies declare the results of placements?,"companies, declare, results, placements, interviews, same day, 11:59 PM",Companies are requested to declare the results immediately after interviews (on the same day before 11:59 PM).
TPO Policy,When are companies expected to declare the results of placements?,"companies, declare, results, placements, interviews, same day, 11:59 PM",Companies are requested to declare the results immediately after interviews (on the same day before 11:59 PM).
TPO Policy,When should companies announce the results of placements?,"companies, announce, results, placements, interviews, same day, 11:59 PM",Companies are requested to declare the results immediately after interviews (on the same day before 11:59 PM).
TPO Policy,When are companies required to declare the results of placements?,"companies, declare, results, placements, interviews, same day, 11:59 PM",Companies are requested to declare the results immediately after interviews (on the same day before 11:59 PM).
TPO Policy,When should companies release the results of placements?,"companies, release, results, placements, interviews, same day, 11:59 PM",Companies are requested to declare the results immediately after interviews (on the same day before 11:59 PM).
TPO Policy,What happens if a company does not declare results on the same day?,"company, declare, results, same day, sit, another company’s process","If a company does not declare results on the same day, students will be allowed to sit for another company’s process."
TPO Policy,What are the consequences if a company does not declare results on the same day?,"company, declare, results, same day, sit, another company’s process","If a company does not declare results on the same day, students will be allowed to sit for another company’s process."
TPO Policy,What if a company fails to declare results on the same day?,"company, declare, results, same day, sit, another company’s process","If a company does not declare results on the same day, students will be allowed to sit for another company’s process."
TPO Policy,What happens to students if a company does not declare results on the same day?,"company, declare, results, same day, sit, another company’s process","If a company does not declare results on the same day, students will be allowed to sit for another company’s process."
TPO Policy,What is the policy if a company does not declare results on the same day?,"company, declare, results, same day, sit, another company’s process","If a company does not declare results on the same day, students will be allowed to sit for another company’s process."
TPO Policy,Can students sit for another company’s process if results are not declared?,"students, sit, another company’s process, results, not declared, same day","Yes, students can sit for another company’s process if the results are not declared on the same day."
TPO Policy,Are students allowed to sit for another company’s process if results are not declared?,"students, sit, another company’s process, results, not declared, same day","Yes, students can sit for another company’s process if the results are not declared on the same day."
TPO Policy,Can students participate in another company’s process if results are not declared?,"students, participate, another company’s process, results, not declared, same day","Yes, students can sit for another company’s process if the results are not declared on the same day."
TPO Policy,Is it permissible for students to sit for another company’s process if results are not declared?,"students, sit, another company’s process, results, not declared, same day","Yes, students can sit for another company’s process if the results are not declared on the same day."
TPO Policy,Can students apply for another company’s process if results are not declared?,"students, apply, another company’s process, results, not declared, same day","Yes, students can sit for another company’s process if the results are not declared on the same day."
