category,question,keywords,answer
TPO Policy,What is the TPO's goal for the end of the year?,"TPO, end of year, goal, student placement",The aim is to have the maximum number of students placed in companies of their liking.
TPO Policy,What does the TPO strive for at the end of the year?,"TPO, end of year, strive, student placement",The aim is to have the maximum number of students placed in companies of their liking.
TPO Policy,Is the TPO neutral in its operations? Explain.,"TPO, neutral, facilitator, students, companies","Yes, the TPO is an impartial body. It acts as a facilitator working for the benefit of the students and the visiting companies."
TPO Policy,Is the TPO unbiased? Explain.,"TPO, unbiased, facilitator, students, companies","Yes, the TPO is an impartial body. It acts as a facilitator working for the benefit of the students and the visiting companies."
TPO Policy,Is the TPO fair in its dealings? Explain.,"TPO, fair, facilitator, students, companies","Yes, the TPO is an impartial body. It acts as a facilitator working for the benefit of the students and the visiting companies."
TPO Policy,Is the TPO objective in its role? Explain.,"TPO, objective, facilitator, students, companies","Yes, the TPO is an impartial body. It acts as a facilitator working for the benefit of the students and the visiting companies."
TPO Policy,What is important for students to do when applying to companies?,"students, apply, companies, updated information, Superset","Students must provide the latest, updated information while applying to companies and ensure their data in the Superset software is regularly updated."
TPO Policy,What must students do to ensure successful applications to companies?,"students, apply, companies, updated information, Superset","Students must provide the latest, updated information while applying to companies and ensure their data in the Superset software is regularly updated."
TPO Policy,What should students keep in mind while applying to companies?,"students, apply, companies, updated information, Superset","Students must provide the latest, updated information while applying to companies and ensure their data in the Superset software is regularly updated."
TPO Policy,What are the requirements for students when applying to companies?,"students, apply, companies, updated information, Superset","Students must provide the latest, updated information while applying to companies and ensure their data in the Superset software is regularly updated."
TPO Policy,Which software is recommended for students to update their information?,"students, update, information, Superset",Students should use the Superset software to update their information.
TPO Policy,What is the preferred software for students to update their information?,"students, update, information, Superset",Students should use the Superset software to update their information.
TPO Policy,Which software should students use for updating their information?,"students, update, information, Superset",Students should use the Superset software to update their information.
TPO Policy,What software is used by students to update their information?,"students, update, information, Superset",Students should use the Superset software to update their information.
TPO Policy,What are the consequences of not informing the TPO about further studies?,"students, inform, TPO, further studies, LoR, graduation certificate",Failure to inform the TPO followed by subsequent withdrawal from the placement process will lead to the withholding of the Letter of Recommendation (LoR) and/or the final graduation certificate.
TPO Policy,What if students don't notify the TPO about pursuing further studies?,"students, notify, TPO, further studies, LoR, graduation certificate",Failure to inform the TPO followed by subsequent withdrawal from the placement process will lead to the withholding of the Letter of Recommendation (LoR) and/or the final graduation certificate.
TPO Policy,What is the penalty for not informing the TPO about further studies?,"students, inform, TPO, further studies, LoR, graduation certificate",Failure to inform the TPO followed by subsequent withdrawal from the placement process will lead to the withholding of the Letter of Recommendation (LoR) and/or the final graduation certificate.
TPO Policy,What happens if students don't update the TPO about further studies?,"students, update, TPO, further studies, LoR, graduation certificate",Failure to inform the TPO followed by subsequent withdrawal from the placement process will lead to the withholding of the Letter of Recommendation (LoR) and/or the final graduation certificate.
TPO Policy,What are the criteria for students pursuing higher education to apply for companies?,"students, higher education, criteria, apply, companies, LPA","Students pursuing higher education are eligible to apply to companies offering: ≤ 12 LPA for CE, IT, and Circuital branches. ≤ 10 LPA for all other branches."
TPO Policy,What are the requirements for students pursuing higher education to apply for companies?,"students, higher education, requirements, apply, companies, LPA","Students pursuing higher education are eligible to apply to companies offering: ≤ 12 LPA for CE, IT, and Circuital branches. ≤ 10 LPA for all other branches."
TPO Policy,What are the conditions for students pursuing higher education to apply for companies?,"students, higher education, conditions, apply, companies, LPA","Students pursuing higher education are eligible to apply to companies offering: ≤ 12 LPA for CE, IT, and Circuital branches. ≤ 10 LPA for all other branches."
TPO Policy,What are the qualifications for students pursuing higher education to apply for companies?,"students, higher education, qualifications, apply, companies, LPA","Students pursuing higher education are eligible to apply to companies offering: ≤ 12 LPA for CE, IT, and Circuital branches. ≤ 10 LPA for all other branches."
TPO Policy,"What is the highest CTC for CE, IT, and Circuital branches for students pursuing higher education?","CTC, CE, IT, Circuital branches, higher education, 12 LPA",The maximum CTC allowed is 12 LPA.
TPO Policy,"What is the upper limit of CTC for CE, IT, and Circuital branches for students pursuing higher education?","CTC, CE, IT, Circuital branches, higher education, 12 LPA",The maximum CTC allowed is 12 LPA.
TPO Policy,"What is the maximum salary cap for CE, IT, and Circuital branches for students pursuing higher education?","CTC, CE, IT, Circuital branches, higher education, 12 LPA",The maximum CTC allowed is 12 LPA.
TPO Policy,"What is the maximum CTC for CE, IT, and Circuital branches for students pursuing higher education?","CTC, CE, IT, Circuital branches, higher education, 12 LPA",The maximum CTC allowed is 12 LPA.
TPO Policy,What is the highest CTC for other branches for students pursuing higher education?,"CTC, other branches, higher education, 10 LPA",The maximum CTC allowed is 10 LPA.
TPO Policy,What is the upper limit of CTC for other branches for students pursuing higher education?,"CTC, other branches, higher education, 10 LPA",The maximum CTC allowed is 10 LPA.
TPO Policy,What is the maximum salary cap for other branches for students pursuing higher education?,"CTC, other branches, higher education, 10 LPA",The maximum CTC allowed is 10 LPA.
TPO Policy,What is the maximum CTC for other branches for students pursuing higher education?,"CTC, other branches, higher education, 10 LPA",The maximum CTC allowed is 10 LPA.
TPO Policy,What are the consequences of using unfair means during the placement process?,"student, unfair means, placement process, debarred",Any student found using unfair means will be debarred from the placement process.
TPO Policy,What if a student uses unfair means during the placement process?,"student, unfair means, placement process, debarred",Any student found using unfair means will be debarred from the placement process.
TPO Policy,What is the penalty for using unfair means during the placement process?,"student, unfair means, placement process, debarred",Any student found using unfair means will be debarred from the placement process.
TPO Policy,What happens if a student is caught using unfair means during the placement process?,"student, unfair means, placement process, debarred",Any student found using unfair means will be debarred from the placement process.
TPO Policy,Does the TPO ensure equal opportunities for all students?,"TPO, equal opportunities, criteria, shortlisting, package, final selection","The TPO tries its best to give all students equal opportunities, but the criteria, shortlisting, package, and final selection are decided by the companies, not the TPO."
TPO Policy,Is there equal opportunity for all students provided by the TPO?,"TPO, equal opportunity, criteria, shortlisting, package, final selection","The TPO tries its best to give all students equal opportunities, but the criteria, shortlisting, package, and final selection are decided by the companies, not the TPO."
TPO Policy,Does the TPO provide equal chances to all students?,"TPO, equal chances, criteria, shortlisting, package, final selection","The TPO tries its best to give all students equal opportunities, but the criteria, shortlisting, package, and final selection are decided by the companies, not the TPO."
TPO Policy,Does the TPO ensure that all students have equal opportunities?,"TPO, equal opportunities, criteria, shortlisting, package, final selection","The TPO tries its best to give all students equal opportunities, but the criteria, shortlisting, package, and final selection are decided by the companies, not the TPO."
TPO Policy,"Who is responsible for setting the criteria, shortlisting, package, and final selection during placements?","criteria, shortlisting, package, final selection, companies","The companies decide the criteria, shortlisting, package, and final selection during placements."
TPO Policy,"Who determines the criteria, shortlisting, package, and final selection during placements?","criteria, shortlisting, package, final selection, companies","The companies decide the criteria, shortlisting, package, and final selection during placements."
TPO Policy,"Who sets the criteria, shortlisting, package, and final selection during placements?","criteria, shortlisting, package, final selection, companies","The companies decide the criteria, shortlisting, package, and final selection during placements."
TPO Policy,"Who decides on the criteria, shortlisting, package, and final selection during placements?","criteria, shortlisting, package, final selection, companies","The companies decide the criteria, shortlisting, package, and final selection during placements."
TPO Policy,What should students wear for campus drives?,"students, campus drives, formals",Students must come in formals for any campus drive process.
TPO Policy,What is the required attire for students during campus drives?,"attire, students, campus drives, formals",Students must come in formals for any campus drive process.
TPO Policy,What is the dress code for campus drives?,"dress code, campus drives, formals",Students must come in formals for any campus drive process.
TPO Policy,What should students wear to campus drives?,"students, campus drives, formals",Students must come in formals for any campus drive process.
TPO Policy,"What documents should students carry during PPT, GD, or PI?","students, PPT, GD, PI, Identity Card, visiting team, TPO staff",Students must carry their Identity Card and produce it when demanded by the visiting team or TPO staff.
TPO Policy,"What should students bring to PPT, GD, or PI?","students, PPT, GD, PI, Identity Card, visiting team, TPO staff",Students must carry their Identity Card and produce it when demanded by the visiting team or TPO staff.
TPO Policy,"What items should students carry during PPT, GD, or PI?","students, PPT, GD, PI, Identity Card, visiting team, TPO staff",Students must carry their Identity Card and produce it when demanded by the visiting team or TPO staff.
TPO Policy,"What should students have with them during PPT, GD, or PI?","students, PPT, GD, PI, Identity Card, visiting team, TPO staff",Students must carry their Identity Card and produce it when demanded by the visiting team or TPO staff.
TPO Policy,What should students do with the contacts of different companies?,"students, contacts, companies, TPO, placements",Students should share the contacts they have with the TPO so that the TPO may formally invite these companies for placements.
TPO Policy,What action should students take if they have contacts of different companies?,"students, contacts, companies, TPO, placements",Students should share the contacts they have with the TPO so that the TPO may formally invite these companies for placements.
TPO Policy,What should students do if they have contacts of various companies?,"students, contacts, companies, TPO, placements",Students should share the contacts they have with the TPO so that the TPO may formally invite these companies for placements.
TPO Policy,What should students do if they have contacts of multiple companies?,"students, contacts, companies, TPO, placements",Students should share the contacts they have with the TPO so that the TPO may formally invite these companies for placements.
TPO Policy,Can students communicate directly with company officials?,"direct communication, company officials, not allowed, appropriate action","No, direct communication with company officials is not allowed. If any student is found to do so, appropriate action will be taken against them."
TPO Policy,Is it permitted for students to contact company officials directly?,"direct communication, company officials, not allowed, appropriate action","No, direct communication with company officials is not allowed. If any student is found to do so, appropriate action will be taken against them."
TPO Policy,Are students allowed to communicate directly with company officials?,"direct communication, company officials, not allowed, appropriate action","No, direct communication with company officials is not allowed. If any student is found to do so, appropriate action will be taken against them."
TPO Policy,Is it allowed for students to have direct contact with company officials?,"direct communication, company officials, not allowed, appropriate action","No, direct communication with company officials is not allowed. If any student is found to do so, appropriate action will be taken against them."
TPO Policy,What are the consequences of violating the rule?,"student, violates, rule, appropriate action","If a student is found communicating directly with company officials, appropriate action will be taken against them."
TPO Policy,What if a student breaks this rule?,"student, breaks, rule, appropriate action","If a student is found communicating directly with company officials, appropriate action will be taken against them."
TPO Policy,What is the penalty for violating this rule?,"student, violates, rule, appropriate action","If a student is found communicating directly with company officials, appropriate action will be taken against them."
TPO Policy,What happens if a student is caught breaking this rule?,"student, caught, rule, appropriate action","If a student is found communicating directly with company officials, appropriate action will be taken against them."
TPO Policy,What should students do if they encounter problems during the placement process?,"students, problems, placement process, TPO CRs",Students should approach their respective TPO CRs in case of any issues.
TPO Policy,What should students do if they face difficulties during the placement process?,"students, difficulties, placement process, TPO CRs",Students should approach their respective TPO CRs in case of any issues.
TPO Policy,What should students do if they have any issues during the placement process?,"students, issues, placement process, TPO CRs",Students should approach their respective TPO CRs in case of any issues.
TPO Policy,What should students do if they face any challenges during the placement process?,"students, challenges, placement process, TPO CRs",Students should approach their respective TPO CRs in case of any issues.
TPO Policy,Is participation in the placement process mandatory after applying to a company?,"mandatory, placement process, applied, company","Yes, it is mandatory for students who have applied to a company to participate in the placement process of that company."
TPO Policy,Is it required for students to participate in the placement process after applying to a company?,"required, placement process, applied, company","Yes, it is mandatory for students who have applied to a company to participate in the placement process of that company."
TPO Policy,Do students have to participate in the placement process after applying to a company?,"required, placement process, applied, company","Yes, it is mandatory for students who have applied to a company to participate in the placement process of that company."
TPO Policy,Is it necessary for students to participate in the placement process after applying to a company?,"necessary, placement process, applied, company","Yes, it is mandatory for students who have applied to a company to participate in the placement process of that company."
TPO Policy,Is it mandatory to attend PPT after applying to a company?,"attendance, PPT, mandatory, applied, company, eligible","Yes, attendance in PPT is mandatory after applying to a company to be eligible for further placement processes."
TPO Policy,Is attending PPT mandatory after applying to a company?,"attendance, PPT, mandatory, applied, company, eligible","Yes, attendance in PPT is mandatory after applying to a company to be eligible for further placement processes."
TPO Policy,Is PPT attendance mandatory after applying to a company?,"attendance, PPT, mandatory, applied, company, eligible","Yes, attendance in PPT is mandatory after applying to a company to be eligible for further placement processes."
TPO Policy,Do students have to attend PPT after applying to a company?,"attendance, PPT, mandatory, applied, company, eligible","Yes, attendance in PPT is mandatory after applying to a company to be eligible for further placement processes."
TPO Policy,What are the consequences if a student leaves the placement process after PPT?,"student, leaves, placement process, PPT, debarred, future placement","If a student quits the process after PPT, they will be debarred and not allowed to appear in any other future placement event."
TPO Policy,What if a student stops participating in the placement process after PPT?,"student, stops, placement process, PPT, debarred, future placement","If a student quits the process after PPT, they will be debarred and not allowed to appear in any other future placement event."
TPO Policy,What happens if a student withdraws from the placement process after PPT?,"student, withdraws, placement process, PPT, debarred, future placement","If a student quits the process after PPT, they will be debarred and not allowed to appear in any other future placement event."
TPO Policy,What are the repercussions if a student quits the placement process after PPT?,"student, quits, placement process, PPT, debarred, future placement","If a student quits the process after PPT, they will be debarred and not allowed to appear in any other future placement event."
TPO Policy,What are the consequences of misbehavior during the placement process?,"misbehavior, placement process, debarred, future placements","Any kind of misbehavior/complaints reported by the company officials will be taken seriously, and if proven, the student will be debarred from future campus placements."
TPO Policy,What if a student is reported for misbehavior during the placement process?,"student, misbehavior, placement process, debarred, future placements","Any kind of misbehavior/complaints reported by the company officials will be taken seriously, and if proven, the student will be debarred from future campus placements."
TPO Policy,What happens if a student is found misbehaving during the placement process?,"student, misbehaving, placement process, debarred, future placements","Any kind of misbehavior/complaints reported by the company officials will be taken seriously, and if proven, the student will be debarred from future campus placements."
TPO Policy,What are the repercussions of misbehavior during the placement process?,"misbehavior, placement process, debarred, future placements","Any kind of misbehavior/complaints reported by the company officials will be taken seriously, and if proven, the student will be debarred from future campus placements."
TPO Policy,How can a blacklisted student request to be removed from the blacklist?,"blacklisted student, removal, blacklist, placement committee",A blacklisted student can approach the placement committee to make a formal request for removal from the blacklist.
TPO Policy,What steps should a blacklisted student take to be removed from the blacklist?,"blacklisted student, removal, blacklist, placement committee",A blacklisted student can approach the placement committee to make a formal request for removal from the blacklist.
TPO Policy,How can a blacklisted student get off the blacklist?,"blacklisted student, removal, blacklist, placement committee",A blacklisted student can approach the placement committee to make a formal request for removal from the blacklist.
TPO Policy,What should a blacklisted student do if they want to be removed from the blacklist?,"blacklisted student, removal, blacklist, placement committee",A blacklisted student can approach the placement committee to make a formal request for removal from the blacklist.
TPO Policy,Who makes the final decision on removing a student from the blacklist?,"final decision, remove, student, blacklist, director","If the committee rejects the request, the student can approach the director, whose decision will be final and binding."
TPO Policy,Who has the authority to remove a student from the blacklist?,"authority, remove, student, blacklist, director","If the committee rejects the request, the student can approach the director, whose decision will be final and binding."
TPO Policy,Who has the final say in removing a student from the blacklist?,"final say, remove, student, blacklist, director","If the committee rejects the request, the student can approach the director, whose decision will be final and binding."
TPO Policy,Who decides the final outcome of removing a student from the blacklist?,"final outcome, remove, student, blacklist, director","If the committee rejects the request, the student can approach the director, whose decision will be final and binding."
TPO Policy,What should students do if they are not participating in the placement/internship process?,"students, inform, TPO, placement, internship, not participating",Students must inform the TPO as soon as possible if they do not plan to sit for the placement/internship process.
TPO Policy,What should students do if they do not intend to sit for the placement/internship process?,"students, inform, TPO, placement, internship, not intend",Students must inform the TPO as soon as possible if they do not plan to sit for the placement/internship process.
TPO Policy,What should students do if they are not planning to sit for the placement/internship process?,"students, inform, TPO, placement, internship, not planning",Students must inform the TPO as soon as possible if they do not plan to sit for the placement/internship process.
TPO Policy,What should students do if they decide not to sit for the placement/internship process?,"students, inform, TPO, placement, internship, decide not to",Students must inform the TPO as soon as possible if they do not plan to sit for the placement/internship process.
TPO Policy,Under what conditions can students withdraw from the placement process to pursue postgraduate studies?,"students, withdraw, placement process, postgraduate studies, conditions, TPO CR",Students who have not yet secured a final offer can withdraw from the placement process to pursue postgraduate studies. They must communicate this decision to the designated TPO CR to ensure their preferences are accurately recorded.
TPO Policy,"Can students leave the placement process to pursue postgraduate studies? If so, what are the conditions?","students, leave, placement process, postgraduate studies, conditions, TPO CR",Students who have not yet secured a final offer can withdraw from the placement process to pursue postgraduate studies. They must communicate this decision to the designated TPO CR to ensure their preferences are accurately recorded.
TPO Policy,What are the conditions for students to withdraw from the placement process to pursue postgraduate studies?,"students, withdraw, placement process, postgraduate studies, conditions, TPO CR",Students who have not yet secured a final offer can withdraw from the placement process to pursue postgraduate studies. They must communicate this decision to the designated TPO CR to ensure their preferences are accurately recorded.
TPO Policy,"Can students opt-out of the placement process to pursue postgraduate studies? If yes, what are the conditions?","students, opt-out, placement process, postgraduate studies, conditions, TPO CR",Students who have not yet secured a final offer can withdraw from the placement process to pursue postgraduate studies. They must communicate this decision to the designated TPO CR to ensure their preferences are accurately recorded.
TPO Policy,How can students rejoin the placement process after opting out?,"students, rejoin, placement process, opting out, TPO CR",Students who previously opted out of the placement process must notify their TPO CR to amend their preferences before applying for on-campus opportunities.
